{
  "specVersion": "1.3.0",
  "kind": "form-template",
  "form": {
    "id": "f1040",
    "name": "U.S. Individual Income Tax Return",
    "taxYear": 2025,
    "version": "2025-1",
    "officialAcroForm": "https://www.irs.gov/pub/irs-pdf/f1040.pdf"
  },
  "pageSize": {
    "width": 612,
    "height": 792
  },
  "pages": [
    {
      "index": 0,
      "label": "Page 1",
      "fields": [
        {
          "id": "tp.nameFirst",
          "name": "Your first name and middle initial",
          "acroField": "f1_14",
          "rect": {
            "x": 36.0,
            "y": 94.0,
            "width": 215.2,
            "height": 14.0
          },
          "placement": {
            "hAlign": "left",
            "vAlign": "middle",
            "fontFamily": "helvetica",
            "fontSize": {
              "mode": "fixed",
              "size": 9
            },
            "overflow": "truncate",
            "multiLine": false
          }
        },
        {
          "id": "tp.nameLast",
          "name": "Your last name",
          "acroField": "f1_15",
          "rect": {
            "x": 253.0,
            "y": 94.0,
            "width": 214.2,
            "height": 14.0
          },
          "placement": {
            "hAlign": "left",
            "vAlign": "middle",
            "fontFamily": "helvetica",
            "fontSize": {
              "mode": "fixed",
              "size": 9
            },
            "overflow": "truncate",
            "multiLine": false
          }
        },
        {
          "id": "tp.ssn",
          "name": "Your social security number",
          "acroField": "f1_16",
          "rect": {
            "x": 469.0,
            "y": 94.0,
            "width": 107.0,
            "height": 14.0
          },
          "placement": {
            "hAlign": "left",
            "vAlign": "middle",
            "fontFamily": "helvetica",
            "fontSize": {
              "mode": "fixed",
              "size": 9
            },
            "overflow": "truncate",
            "multiLine": false
          }
        },
        {
          "id": "sp.nameFirst",
          "name": "Spouse's first name and middle initial",
          "acroField": "f1_17",
          "rect": {
            "x": 36.0,
            "y": 118.0,
            "width": 215.2,
            "height": 14.0
          },
          "placement": {
            "hAlign": "left",
            "vAlign": "middle",
            "fontFamily": "helvetica",
            "fontSize": {
              "mode": "fixed",
              "size": 9
            },
            "overflow": "truncate",
            "multiLine": false
          }
        },
        {
          "id": "sp.nameLast",
          "name": "Spouse's last name",
          "acroField": "f1_18",
          "rect": {
            "x": 253.0,
            "y": 118.0,
            "width": 214.2,
            "height": 14.0
          },
          "placement": {
            "hAlign": "left",
            "vAlign": "middle",
            "fontFamily": "helvetica",
            "fontSize": {
              "mode": "fixed",
              "size": 9
            },
            "overflow": "truncate",
            "multiLine": false
          }
        },
        {
          "id": "sp.ssn",
          "name": "Spouse's social security number",
          "acroField": "f1_19",
          "rect": {
            "x": 469.0,
            "y": 118.0,
            "width": 107.0,
            "height": 14.0
          },
          "placement": {
            "hAlign": "left",
            "vAlign": "middle",
            "fontFamily": "helvetica",
            "fontSize": {
              "mode": "fixed",
              "size": 9
            },
            "overflow": "truncate",
            "multiLine": false
          }
        },
        {
          "id": "addr.street",
          "name": "Home address (number and street)",
          "acroField": "f1_20",
          "rect": {
            "x": 36.0,
            "y": 142.0,
            "width": 380.9,
            "height": 14.0
          },
          "placement": {
            "hAlign": "left",
            "vAlign": "middle",
            "fontFamily": "helvetica",
            "fontSize": {
              "mode": "fixed",
              "size": 9
            },
            "overflow": "truncate",
            "multiLine": false
          }
        },
        {
          "id": "addr.apt",
          "name": "Apt. no.",
          "acroField": "f1_21",
          "rect": {
            "x": 418.6,
            "y": 142.0,
            "width": 48.6,
            "height": 14.0
          },
          "placement": {
            "hAlign": "left",
            "vAlign": "middle",
            "fontFamily": "helvetica",
            "fontSize": {
              "mode": "fixed",
              "size": 9
            },
            "overflow": "truncate",
            "multiLine": false
          }
        },
        {
          "id": "addr.city",
          "name": "City, town, or post office",
          "acroField": "f1_22",
          "rect": {
            "x": 36.0,
            "y": 166.0,
            "width": 294.4,
            "height": 14.0
          },
          "placement": {
            "hAlign": "left",
            "vAlign": "middle",
            "fontFamily": "helvetica",
            "fontSize": {
              "mode": "autofit",
              "min": 7,
              "max": 9
            },
            "overflow": "truncate",
            "multiLine": false
          }
        },
        {
          "id": "addr.state",
          "name": "State",
          "acroField": "f1_23",
          "rect": {
            "x": 332.2,
            "y": 166.0,
            "width": 63.1,
            "height": 14.0
          },
          "placement": {
            "hAlign": "left",
            "vAlign": "middle",
            "fontFamily": "helvetica",
            "fontSize": {
              "mode": "fixed",
              "size": 9
            },
            "overflow": "truncate",
            "multiLine": false
          }
        },
        {
          "id": "addr.zip",
          "name": "ZIP code",
          "acroField": "f1_24",
          "rect": {
            "x": 397.0,
            "y": 166.0,
            "width": 70.2,
            "height": 14.0
          },
          "placement": {
            "hAlign": "left",
            "vAlign": "middle",
            "fontFamily": "helvetica",
            "fontSize": {
              "mode": "fixed",
              "size": 9
            },
            "overflow": "truncate",
            "multiLine": false
          }
        },
        {
          "id": "fs.single",
          "name": "Filing status \u2014 Single",
          "acroField": "c1_8",
          "rect": {
            "x": 97.6,
            "y": 206.0,
            "width": 8.0,
            "height": 8.0
          },
          "placement": {
            "hAlign": "center",
            "vAlign": "middle",
            "fontFamily": "helvetica",
            "fontSize": {
              "mode": "fixed",
              "size": 9
            },
            "overflow": "truncate",
            "multiLine": false
          }
        },
        {
          "id": "fs.mfj",
          "name": "Filing status \u2014 Married filing jointly",
          "acroField": "c1_8",
          "rect": {
            "x": 97.6,
            "y": 218.0,
            "width": 8.0,
            "height": 8.0
          },
          "placement": {
            "hAlign": "center",
            "vAlign": "middle",
            "fontFamily": "helvetica",
            "fontSize": {
              "mode": "fixed",
              "size": 9
            },
            "overflow": "truncate",
            "multiLine": false
          }
        },
        {
          "id": "fs.mfs",
          "name": "Filing status \u2014 Married filing separately",
          "acroField": "c1_8",
          "rect": {
            "x": 97.6,
            "y": 230.0,
            "width": 8.0,
            "height": 8.0
          },
          "placement": {
            "hAlign": "center",
            "vAlign": "middle",
            "fontFamily": "helvetica",
            "fontSize": {
              "mode": "fixed",
              "size": 9
            },
            "overflow": "truncate",
            "multiLine": false
          }
        },
        {
          "id": "fs.hoh",
          "name": "Filing status \u2014 Head of household",
          "acroField": "c1_8",
          "rect": {
            "x": 349.6,
            "y": 206.0,
            "width": 8.0,
            "height": 8.0
          },
          "placement": {
            "hAlign": "center",
            "vAlign": "middle",
            "fontFamily": "helvetica",
            "fontSize": {
              "mode": "fixed",
              "size": 9
            },
            "overflow": "truncate",
            "multiLine": false
          }
        },
        {
          "id": "fs.qss",
          "name": "Filing status \u2014 Qualifying surviving spouse",
          "acroField": "c1_8",
          "rect": {
            "x": 349.6,
            "y": 218.0,
            "width": 8.0,
            "height": 8.0
          },
          "placement": {
            "hAlign": "center",
            "vAlign": "middle",
            "fontFamily": "helvetica",
            "fontSize": {
              "mode": "fixed",
              "size": 9
            },
            "overflow": "truncate",
            "multiLine": false
          }
        },
        {
          "id": "l1a.wagesAmt",
          "name": "1a Total amount from Form(s) W-2, box 1",
          "acroField": "f1_47",
          "rect": {
            "x": 504.0,
            "y": 450.0,
            "width": 72.0,
            "height": 12.0
          },
          "placement": {
            "hAlign": "right",
            "vAlign": "middle",
            "fontFamily": "courier",
            "fontSize": {
              "mode": "fixed",
              "size": 9
            },